2603,春花花幼儿园长沉沉酱,女,2018-02-26 22:34:19,弹幕里说古琴最高只独奏不参与合奏的是不是太可笑了( ?_f｀)我的古琴老师告诉我，古琴一般不参与合奏大多数是因为它声音弱势不适合舞台，合奏会被其他乐器的声音实力碾压，所以除非有古琴大部队否则不参与合奏ok？？？去你的某某最高论，所有的乐器都是平等的，不分高低贵贱,60,6
2602,汝鄢素琰,女,2018-02-26 20:25:42,疯狂打电话，期待第二季！,1,0
2601,镜破难言,男,2018-02-26 19:06:23,突然发现除了B站其他地方都有水井坊的广告[小电视_赞],4,0
2600,小旺旺Lee,男,2018-02-26 16:52:46,(?￣△￣)?,0,0
2599,乐正非非,女,2018-02-26 16:26:30,其实，在围观舌尖三之后，我突然担心，国家宝藏2……希望我担心多余吧……,14,8
2598,揽月影花雨,保密,2018-02-26 15:08:43,浙江省博物馆馆长真神秘[小电视_吃惊]一整期不知道是谁(°?°)?,14,1
2597,歌U九儿,保密,2018-02-26 14:45:41,历史老师推荐看的，原本以为无聊，现在发现真的好好看,7,0
2596,Handsomegir1,女,2018-02-26 13:48:35,凌晨在被窝里一边看一边泪目稀里哗啦的嘤嘤嘤,3,0
2595,三叶堇,保密,2018-02-26 10:09:15,"贺兰山这也有先生的艺术馆，人文鉴赏课的老师带我们参观过~超赞!!(°?°)?就在山半腰，岩画馆前的一个石头上还有先生的题字，&#34;岁月失语，唯石能言&#34;(=?ω?=)
一进艺术馆的墙上，就看到有先生的话&#34;上苍告诉我:韩美林，你就是头牛，这辈子你就干活吧！&#34;",8,1
2594,祝你心想事成,保密,2018-02-26 03:01:53,这期观看好少啊,0,0
2593,MuSyi,女,2018-02-26 02:26:26,吴彤青歌赛演唱的很好听!AV15526534第**后面,0,0
2592,乐正龙修,男,2018-02-26 01:42:50,我们第二季再见[小电视_哭泣][小电视_哭泣][小电视_哭泣],2,0
2591,鹤家九只笙,女,2018-02-26 01:10:51,心中一腔热血从开头沸到结尾。。下辈子还是要做种花人。（弹古琴的种花人）,2,0
2590,突击君,保密,2018-02-26 00:42:23,想了半天，还是留句我是中国人吧。,2,0
2589,冬日端阳,女,2018-02-25 23:29:39,诗朗诵真的好！真的好,0,0
2588,上尽重城更上楼,保密,2018-02-25 23:26:12,完结了，看完心里百感交集，而最大的感触就是中华文明这一路走来太不容易了。,1,0
2587,青色椰子,保密,2018-02-25 23:23:33,看有些弹幕提到古琴独奏的问题，只是想稍微解释一下，古琴大多是独奏，一个是古琴的声音比较小，哪怕是用了扩音器也相对小，一旦合奏乐器多了，再加上有鼓点的配乐，古琴声就被淹没了。另一个是古琴的音色笔记适合独奏，它的韵味是需要安静的环境才能感受到，那些细微的吟挠，细腻尾音等等，合奏的话，最多是和一个乐器合奏（萧、瑟什么的，虽然有时候听琴箫合奏，萧哪怕不用扩音器，古琴用扩音器，都会觉得古琴声太小。）或者像这样，古琴单独奏一段，其他乐器合奏另一段。声音小这是它的缺点，也是它的特点，因为即使改造一下它的结构，声音也是可以像古筝那样大的，但韵味就不是古琴的韵味了。,10,2
2585,青色椰子,保密,2018-02-25 22:05:27,哈哈哈大家对金主爸爸好关心啊,8,1
2584,氵明,男,2018-02-25 22:02:35,这些都是我中华神器,1,0
2583,Remix混音时代,女,2018-02-25 21:47:38,开头不知道看了多少遍,0,0
2582,毕竟吃素,保密,2018-02-25 20:34:03,"心中激荡，难以表述。
国家宝藏，藏宝家国。
大国泱泱，华夏煌煌。
此生华夏，来生种花。",10,0
2581,我爱广式脆皮鸭,保密,2018-02-25 20:01:20,第十集才36.8W点击啊,1,3
2580,德军狂风战斗机,男,2018-02-25 14:46:08,催更第二季,2,0
2579,啊啊莫夕林,女,2018-02-25 13:57:14,日常打卡，表白国家宝藏！！！?(???????)?,0,0
2578,玛德智力超群,女,2018-02-25 12:06:21,这播放量好危险呀,1,0
2577,Capricorn_Zz,女,2018-02-25 00:04:37,期待更多这种水平的节目,0,0
2576,Capricorn_Zz,女,2018-02-25 00:04:22,感动[小电视_赞][小电视_赞][小电视_赞]期待第二季,0,0
2575,我是小小变态,保密,2018-02-24 23:40:22,好看，好看，好看[小电视_太太喜欢],0,0
2574,喵喵喵嗷喵喵喵,保密,2018-02-24 23:05:30,为什么我搜梁家辉会有国家宝藏？,2,1
2572,在下沈彗星,保密,2018-02-24 23:04:20,好喜欢果粒叔啊，希望不要换讲解员，永远001都好,5,0
2571,菜菜采,保密,2018-02-24 22:58:39,好感动,0,0
2570,遗忘中二少年,保密,2018-02-24 22:42:23,先收藏，有空看,0,0
2569,比例比GG公告v,保密,2018-02-24 22:06:21,你们这些人够了！我点赞实在点不过来了！,4,0
2568,山歌咩咩在吃草草,保密,2018-02-24 21:52:30,真的都是神仙！！清华美院是我的目标！！,1,0
2567,铍皇-伊卡尔迪,保密,2018-02-24 21:12:56,"今年考完研，再仔细品味各文物，尤其是获展文物，艺术价值不分高下，观众更喜爱的往往有厚重历史价值，更无一不体现着时代精神。
这些文物每件都是一到考研答题。
民族文化正是，爱国敬业更就不说了，今年很火的依法治国、科技创新、国际命运共同体甚至湾湾问题无不涉及，这是完美的政治课，是让人爱不释手的政治课。
总之，文化自信，让那些日精的流言不攻自破。
工科生水平有限。",9,0
2566,无尽狂徒,保密,2018-02-24 20:09:11,期待第二季！,1,0
2565,菊舰万岁,保密,2018-02-24 19:41:51,好期待后续(?；ω；`),0,0
2564,E灰蓝色,男,2018-02-24 19:34:23,目前为止，看到的最高分，b站有十分的吗？,3,0
2563,文艺复兴1007,保密,2018-02-24 19:27:54,希望可以上传赢在博物馆,0,0
2562,骑蜗牛追灰机,女,2018-02-24 18:58:16,感觉乾隆帝被玩坏了,0,0
2561,你也想拉屎吗,保密,2018-02-24 13:16:49,我想问投票在哪里,0,1
2560,hamishholms,保密,2018-02-24 12:35:29,幕后的故事，指路 av19439481,2,0
2559,大周国顺民风帆,男,2018-02-24 11:11:32,27件国宝请玛法出周边，谢谢。千里江山图床上四件套。杜虎符纸镇啥的。大克鼎洗衣篮。。。。,18,1
2558,美妈你好我是美厨,男,2018-02-24 09:17:43,好看，期待，下一季( ?_f｀),0,0
2557,赶着投胎,男,2018-02-24 00:10:16,常老先生身体不好，希望台毒们别为难他，哎。。。,16,0
2555,_顽子酱_,保密,2018-02-23 23:29:53,完结打卡,1,0
2554,丶薄寒丶,女,2018-02-23 22:58:19,不是说组团19年去浙江，20年去故宫嘛...怎么没人召集呢...,0,0
