2767,帽子不够戴,保密,2018-03-30 19:25:56,一想到新艺考了国家宝藏就气，没看过，不知道咋写（/TДT)/(□)/,0,0
2766,涂谷歌,保密,2018-03-30 19:24:43,29个演员 21个男演员 这比例。。。,0,1
2765,羽瑶笙歌,女,2018-03-28 23:58:53,唉，又哭了(?；ω；`)宁寿宫真的很冷清还是座冷宫，待了一个多小时出来指尖冻木了，大年初三去的，听见有人说这屋里都是些破石头的时候百味杂陈......抱抱多灾多难还被埋没的石鼓（/TДT)/,6,0
2764,真爱卤蛋祺,保密,2018-03-28 23:41:26,我来发这条评论(;?_?)就是想问问130:48:30之后是啥内容(□)/啊……困在开头03:31欢迎回来（/TДT)/欢迎回来（/TДT)/欢迎回来（/TДT)/欢迎回来（/TДT)/欢迎回来（/TДT)/欢迎回来（/TДT)/欢迎回来（/TДT)/欢迎回来（/TДT)/欢迎回来（/TДT)/欢迎回来（/TДT)/……出不去了（￣￣）一次又一次的听剑啸头皮发麻的感觉真刺激。,2,0
2763,谎言944,保密,2018-03-28 22:28:25,棒棒哒,0,0
2762,爱动漫的茄子,保密,2018-03-27 22:42:31,为了第十期的音乐……我是来炸成炮仗的……,7,0
2761,You-deserve,保密,2018-03-27 03:17:45,我是中国人，我打心底里喜欢自己是一个中国人，觉得中国人的精神世界丰满很多，来世还做中国人,5,0
2760,PQ九州,男,2018-03-26 22:49:56,《国家宝藏》节目拟计划落地呈现给香港及周边地区的观众。与此同时，第二季节目的筹备调研工作也正在紧锣密鼓的进行中，预计2018年第四季度将会在中央电视台播出。,23,1
2759,念白粥,男,2018-03-26 20:43:28,"回顾将进酒那一段，想说一点东西……
我以前在音乐区浪得比较多吧，有一些音乐up不顾诗意词意就乱谱曲…旋律和意思完全不搭，底下还有一群闭眼吹
我真的是。。十层粉丝滤镜也挡不住我的厌恶之心",16,1
2758,gem_cc,保密,2018-03-26 13:05:02,我是中国人，泪目,1,0
2757,这是一年份的节操拿好,男,2018-03-25 22:50:45,其实四川也每集都有出现,6,0
2756,tf_lili,保密,2018-03-25 22:47:46,官方微信说第二季正在筹备，今年第四季度播！好开心！！！,9,0
2755,班副,保密,2018-03-25 21:20:41,普及一下知识吧，弹幕里说繁体字好，我补充一下其实我们现在用的许多简体字在古代就有，如果你有兴趣看一下宋明时期书画就有不少简体字，而且现在大家知道繁体字是清朝版的，是清军入关后为了自己统治改的。其实文字简化是社会和文明进步表现，中国从文字诞生就在简化文字，简化文字更容易书写和学习，中华民族一直是勤劳且务实的民族。所以我想告诉大家鼓吹改回繁体字的人是既不懂中国文字更不懂中国文化，古人知道简化文字今人何必逆水而上呢。,48,3
2754,二二二二音,女,2018-03-25 14:30:05,完结打卡，最后说到有第二季激动的飞起来！期待！,5,0
2753,双子星也,保密,2018-03-25 12:25:44,。。。。,1,0
2752,天潭叔鱼,保密,2018-03-24 22:20:29,诗朗诵《我是中国人》 BGM：Overcome 作者： Brand X Music,2,1
2751,Rolos,男,2018-03-24 20:59:08,"我再说一遍，都给我听好了
我 是 中 国 人
[小电视_思索]",15,1
2750,三玖夫君,男,2018-03-23 13:50:48,水龙吟和闻一多的诗撸了10遍有余了。,7,1
2749,霸道总裁黄少天,保密,2018-03-22 11:41:17,今天广东一模政治考到国家宝藏了！！！滚过来重温，顺便考试的时候一无聊就把九大博物馆和文物默出来了(=?ω?=),13,0
2748,eddatan,保密,2018-03-21 17:08:39,这个纪录片应该也出英文版啊,7,1
2747,白执事ヘ浮华,保密,2018-03-21 13:57:00,开头的水龙吟真的太好听啦啦啦(°?°)?,8,0
2746,华锐--李泽言,男,2018-03-21 13:46:08,有毛病，从第一期就刷哑舍刷到现在,6,0
2745,厌生且谋生,女,2018-03-21 11:00:03,想这个节目…没事来这重看,3,0
2744,不思不琢不成魔,保密,2018-03-21 10:17:02,这个节目很神奇，每次看都可以使我浮躁的心情沉寂下来，进而热血澎湃！,9,0
2743,猥小胖,保密,2018-03-20 21:30:14,"守护语总结：
001期 紫微星之城―故宫博物院 
守护历史，守护绿水青山（千里江山卷）
守护历史，守护国之瑰宝（各种釉彩大瓶）
守护历史，守护中华文脉（石鼓）
院选语：六百光阴似云梦，百万珍宝藏古今。
002期 火与铜的共舞―湖北省博物馆
守护历史，守护中国剑魂（越王勾践剑）
守护历史，守护律法初心（云梦睡虎地秦简）
守护历史，守护华夏正音（曾侯乙编钟）
院选语：千秋不朽匠人心，圣明法度后可依，国色之声赴天下。
003期 上古文明开源之地―河南博物院
守护历史，守护华夏英姿（妇好^尊）
守护历史，守护华夏初音（贾湖骨笛）
守护历史，守护强国智造（云纹铜禁）
院选语：战无不胜气盖世，酒以成礼后世谨，声闻于天千古鸣。
004期 四朝文明定鼎天下―陕西历史博物馆
守护历史，守护丝路芬芳（葡萄花鸟纹银香囊）
守护历史，守护安国之信（杜虎符）
守护历史，守护盛世威仪（阙楼仪仗图）
院选语：香气绕梁，令下三军，梦回盛唐。
005期 新中国第一座博物馆―辽宁省博物馆
守护历史，守护妙笔丹青（宋人摹顾恺之《洛神赋图》）
守护历史，守护草原丝路（铜鎏金木芯马镫）
守护历史，守护笔墨乾坤（《万岁通天帖》）
院选语：大师妙笔绘传奇，铁马金戈战沙场，笔墨之间有乾坤。
006期 见证华夏文明多源头格局―湖南省博物馆 
守护历史，守护中国制造（长沙窑青釉褐彩诗文执壶）
守护历史，守护瑰丽梦想（辛追墓T形帛画）
守护历史，守护上古血脉（皿方）
院选语：辗转流离归家路，天地人间永生梦，五湖四海远名扬。
007期 包罗中国古代艺术万象―上海博物馆 
守护历史，守护强国之计（商鞅方升）
守护历史，守护锦绣中华（莲塘乳鸭图）
守护历史，守护华夏正礼（大克鼎）
院选语：统一度量助霸业，以丝代笔动人心，华夏正礼定天下。
008期 传颂万年越地长歌―浙江省博物馆 
守护历史，守护惠世天工（宁波“万工轿”）
守护历史，守护高山流水（落霞式“彩凤鸣岐”七弦琴）
守护历史，守护玉魂国魄（玉琮）
院选语：巧夺天工匠心诚，玉魂不散信仰真，彩凤鸣岐绕佳音，中华技艺千古承。
009期 中国三大博物馆之一―南京博物院 
守护历史，守护大国匠心（大报恩寺琉璃塔拱门）
守护历史，守护海国图景（坤舆万国全图）
守护历史，守护先贤懿德（竹林七贤与荣启期砖画）
院选语：海国图景观万国，翘首七载盼郎归，和而不同唯求“真”。",33,1
2742,随遇而安的浅色,保密,2018-03-20 19:40:54,哎。怎么没评论了,0,0
2741,木易曰黑土,保密,2018-03-20 13:12:35,你什么时候再出啊qwq,0,0
2740,一笑三千年,保密,2018-03-19 15:00:03,今年的考古学学硕还有文博专硕估计报考的人会更多，二本向上考会更难，哇QAQ我我我加油！本专业的人生存太艰难了，唉学渣渣继续奋斗了_(:3」∠)_,9,3
2739,指南衔花,保密,2018-03-19 14:48:50,9.9的评分,5,0
2738,萌芽孢子,女,2018-03-19 08:23:58,播放量低可能是因为后来很多人都去看央视3套了吧。,5,0
2737,狐哒哒,女,2018-03-18 23:22:38,好得无以复加！（￣￣）,0,0
2736,语袂花花,女,2018-03-18 16:12:02,因为我最后一期是在央3看的直播，没有追B站，所以都不知道播放量怎么这么低啊？,3,0
2735,卿九1121,女,2018-03-18 15:18:43,期待第二季(｀?ω??),0,0
2733,Rokuです,女,2018-03-18 08:32:54,呵，其实水龙吟也没多好听，我也就网易云循环了一百多遍而已,9,1
2732,北海之父,男,2018-03-18 00:25:48,这水平可以吊打全球了,2,0
2731,北海之父,男,2018-03-18 00:25:16,山西地表文物可是全国最强,4,0
2730,北海之父,男,2018-03-17 22:32:49,爸爸始终是爸爸，这水平吊的人已经无法看省级频道了,2,0
2729,哒哒哒宝,女,2018-03-17 20:20:13,就一个国家图书馆，三千多万的古籍，还有其他博物馆和民间收藏，哇，真的是长见识了,6,0
2728,智武子,女,2018-03-17 20:19:07,陕西历史牛啊,1,0
2727,华啾苋,女,2018-03-17 19:56:25,真的，现在太多太多声音指向怎样学习英语，如何走出去，可是，恰恰忘却的，却是一次文化回眸的剪影，我们急着向前，却忘了停下来等等，等等文化的墨痕，等等品德的涵养，国家宝藏，让我更加自豪，自豪我生长在这样一个墨香的中国，带我走进历史，谢谢你，我的中国，谢谢你，我们的国家宝藏。,16,0
2726,哒哒哒宝,女,2018-03-17 19:15:48,去百度搜了一下长衫，长知识了，以前看相声和民国剧的时候对这个不太在意[小电视_笑],7,0
2725,00墨墨00,女,2018-03-17 13:35:02,玉先生是不是跟韩美林老师学习过。,1,0
2724,阴阳师-狄仁杰,保密,2018-03-17 11:51:39,完了，开头就出不去了。听了好几天了一直都不想往后看(?；ω；`),1,0
2723,秋凉如霜,保密,2018-03-16 22:58:59,第二季再见。(??ω??),0,0
2722,ETO残党,保密,2018-03-16 21:19:17,第二季见,0,0
2721,纯天然o有污染,女,2018-03-16 11:42:41,每一次看，都感受到不一样的震撼,1,0
2720,搁浅了爱,女,2018-03-16 00:08:29,61:40的时候真的，老爷子眼里带着泪光。说出今生不悔入华夏的时候，眼泪真的哗一下就落了。莫名的感动。,8,0
2719,艾琪拉的猫,保密,2018-03-15 13:51:13,希望第二季有山西博物馆,6,0
2718,我压根就不写作业,保密,2018-03-15 11:17:57,好看好看,1,0
2717,奥卡姆的龙,保密,2018-03-14 19:20:40,话说，那个最后放在台子上的玻璃块淘宝有买的吗？,2,2
2713,蔻蔻的标准,保密,2018-03-14 09:50:12,为何微博所有的央视的发表的都不让评论?这么掩耳盗铃?老百姓的声音你们害怕什么?,2,13
2712,打酱油的洋芋,女,2018-03-14 08:49:52,你千年的一个回眸，就让我失了魂丢了魄,5,0
2711,CokeGo,男,2018-03-13 22:05:44,国宝一夜...妙啊~！[小电视_我好兴奋],2,0
2710,讨厌实在人,保密,2018-03-13 21:49:56,期待第二季！同时随手举报不和谐弹幕，英国讲的历史叫历史，日本讲的历史叫历史，美国讲的历史叫历史，怎么中国讲的就叫糟粕？,16,1
2709,大半夜玩bli,男,2018-03-13 21:41:26,第二季见,0,0
2708,寒禄云雨,保密,2018-03-13 19:45:35,第二季再见！,1,0
2707,以前小名叫小明,保密,2018-03-13 10:02:08,央美和北大在明争暗斗，哈哈,9,1
2706,阿琴家の冷冻气-限定,男,2018-03-12 22:20:59,山里江山图啊 有机会我一定要去看,2,2
2704,反正没人鸟我,保密,2018-03-11 23:48:26,博物馆和博物院有什么区别吗,0,4
2703,墨墨墨水君,保密,2018-03-11 23:41:11,我……不止文化自信了，而且膨胀了,24,0
2702,拾壹楼的疯子馆主,男,2018-03-11 23:00:57,"第二季推荐博物馆： 
重庆三峡博物馆
（首批国家一级博物馆、中央地方共建国家级博物馆、特色巴国文化）
四川省博物院
（西南地区最大的综合性博物馆、全国最具创新力博物馆、特色蜀国文化，张大千书画）
三星堆博物馆
（迄今在西南地区发现的范围最大、延续时间最长、文化内涵最丰富的古城、古国、古蜀文化遗址。三星堆遗址被称为20世纪人类最伟大的考古发现之一，昭示了长江流域与黄河流域一样，同属中华文明的母体，被誉为“长江文明之源”）
建川博物馆
（二战历史、红色历史记忆）",13,5
2701,土豆Pro,男,2018-03-11 22:58:48,各位老师的气质都好棒，很儒雅,0,0
2699,前心安可忘,男,2018-03-11 22:31:44,此生无悔入华夏啊,0,0
2697,半梦半醒的年糕,女,2018-03-11 00:18:24,期待第二季啊！！！！！！,1,0
2696,metalfox,男,2018-03-11 00:07:34,"**********************************/s/11E-ydJ2INTCKZv-D2HyNXg 密码：eozb
悄悄上传网易云(￣幔)
刚还以为发错了o(s□t)o",0,0
2694,我爱山新和她的山新们,保密,2018-03-10 22:12:19,谁能告诉我，第十期开始半小时时的歌叫什么名字？,2,0
2693,大黑蛇,男,2018-03-10 22:05:52,央视：这节目版权其他国家随你用，能拍出来算我输(^?ω?^ ),55,0
2692,爆炒苦力怕,男,2018-03-10 22:04:32,我.....文化自信了....[小电视_哭泣],10,0
2691,户方氏,男,2018-03-10 21:43:21,"浙江省博物馆 丨玉琮
它见证了华夏先民神乎其技的智慧、经天纬地的信仰，见证了五千余年前文明投射至中华大地的灿烂光辉。
知来路，识归途，揭开玉琮之上的雾霭，窥得中华文明多元起源的端倪，明了中华文明世代传承的方向。


 湖北省博物馆丨云梦睡虎地秦简
充满理性思维的创造精神；穿越千年仍可为当代借鉴的法治经验。
云梦睡虎地秦简再次证明了中华民族曾经以优越的法文化长期滋润过东方世界，在新的时期，同样也能以更加丰富的法文化，真正傲然自立于世界进步的法制之林！


  
陕西历史博物馆丨懿德太子墓壁画《阙楼仪仗图》
唐代绘画真品杰作懿德太子墓壁画《阙楼仪仗图》。这幅旷世壁画中展现的广采众长、包容万象的唐文化，恰如今日的中华民族，蕴借历史之气韵，再现盛世之风范。


  
河南博物院丨云纹铜禁
我们的祖先发明失蜡法，铸造出如此细密繁复的纹饰，曾技压四方。
云纹铜禁，不仅显示了中国人惊世的创造力，更象征了谨严克己，明善恶、知进退的中华民族不忘来处的继往，不畏前路的开来！


上海博物馆丨大克鼎
海内瑰宝，华夏正礼，大克鼎姿态厚重、铭文深邃，象征了我们的历史底蕴与民族气质。
它经历前世与今生的命运轨迹如此相似，昭示着一个国家，一个民族，面对动荡的局面依然顽强不屈，追求美好稳定的决心。海内瑰宝，当之无愧。


 
辽宁省博物馆丨唐摹王羲之一门书翰卷
书圣的笔法在盛世流传天下，上达天听，下启万代。唐摹王羲之一门书翰卷（《万岁通天帖》），其中凝结的不朽的文化能够穿越兴衰，庇佑着千千万万有志于书法的后来者，将华夏文明的刚劲和风雅一直流传下去！


南京博物院丨大报恩寺琉璃塔拱门
它精美的琉璃砖面与栩栩如生的图样，令我们得以一窥昔日明朝鼎盛时的繁荣.
这不仅是一座拱门，也是我们文明通往未来的基石，背靠这些历史繁荣与成就，华夏民族将会创造新的世界奇观！


 湖南省博物馆 丨皿方
方之王跌宕曲折的身世，见证了一个国家、一个民族千年的兴衰。
皿方，不仅是宗室血脉敬重之情的见证，更是一件历史的证物，华夏民族复兴的转折，它铭心刻骨；当代中国的盛世自信，它满怀骄傲！

 


故宫博物院丨石鼓
承载着珍贵的故园记忆，逢战乱消匿；遇盛世现身。石鼓，用高妙隽永的汉字，将乡愁，镌刻于时光轨迹之上，任其倏而荏苒，无惧！",6,0
2690,Deadpool真的不叫死侍,男,2018-03-10 20:08:23,还有人N刷吗,3,0
2689,星终-,男,2018-03-10 17:44:07,民族自豪感爆表(^?ω?^ ),3,0
2688,最最最可爱的海绵宝宝,保密,2018-03-10 16:42:33,向身边同学安利这个节目，希望第二季有我大四川啊（￣￣）,5,3
2687,羽卒酱酱,女,2018-03-10 15:54:44,经典咏流传会在b站更吗？,0,2
2686,VeroveryveryModa,男,2018-03-10 15:41:55,爸爸每年出一季好不好(:3_c)_ 收费我都看好不好(:3_c)_,3,0
2685,不会骑扫把是胖女巫,保密,2018-03-10 14:44:19,求第二季，求四川博物馆，川人表示羡慕[小电视_哭泣][小电视_哭泣],5,0
2684,灿灿灿啵啵,女,2018-03-10 14:19:08,我也是来求信中国的！！求更啊！！,0,0
2683,suyuan皓,保密,2018-03-10 12:02:15,潇洒安利,2,0
2682,李白不太白1,男,2018-03-10 03:06:08,我不管，我要看信中国，我要看信中国（/TДT)/（/TДT)/（/TДT)/,2,0
2681,蚂蚁是可爱的人类,保密,2018-03-10 00:13:39,"2018届春晚讲的是中国的“新时代”，不管从什么角度来说它的演出都是在为我们中国增光。
不是看了就完了，是要明白中国现在在做些什么，要明白中国现在面临着什么问题，是要明白其中的道理！
两个节目完全不一样！一个是集合，一个是子集。整体和部分能缺少其中一个？
说到底个个都是死傲娇，每年都说质量不好，结果每年都要看。
Orz",9,0
2680,御坂13205号,保密,2018-03-09 23:24:04,欢迎回家[小电视_哭泣],0,0
2679,VincentLK,男,2018-03-09 22:12:27,58分钟 台湾 大陆,1,1
2677,某B站无名小卒,保密,2018-03-09 20:19:53,默默问一句，那个水晶玻璃，卖么[小电视_我好兴奋][小电视_我好兴奋][小电视_我好兴奋],1,2
2675,_太公望_,男,2018-03-09 17:26:12,看完齐潇洒再来刷一遍！,4,0
2674,有大梦想的巧克力,保密,2018-03-09 17:18:49,我是来问，信中国上不上b站？[小A和小B_喝茶]你说说。,4,3
2673,一只蠢猫,保密,2018-03-09 16:45:25,@捌月沫儿,0,0
2672,奕轼君,女,2018-03-09 13:10:43,一进去看的弹幕立刻带上了耳机！！！,2,0
2671,头像为我老婆,男,2018-03-09 11:21:55,说出来你们可能不信，特朗普身边穿大衣那个一脸慈祥微笑的男人是我大哥,3,0
2670,与菡萏,女,2018-03-09 09:46:21,信中国放不放B站你说,4,0
2669,禁与千寻,保密,2018-03-08 23:15:27,看国家宝藏破天荒的觉得广告商委屈，少的可怜，不惹人厌，亲和啥的。最讨厌酒，突然对水井坊有了好感。,13,1
2668,AIchester,男,2018-03-08 20:49:29,这集只是揭晓特展...展出应该在2020年……,1,0
2667,yin桑,保密,2018-03-08 20:25:04,补完了！期待第二季！！,0,0
2666,暗夜飞雪,男,2018-03-08 20:05:40,我，国家宝藏，给硬币,2,0
2665,星线破红,男,2018-03-08 18:30:31,看了又看,0,0
2664,DoctorRiver,保密,2018-03-07 23:44:19,第二季请让果粒叔继续做讲解员！！！,13,0
2663,法神冕下,保密,2018-03-07 19:06:37,赶快出将进酒单曲啊！,4,1
2662,唐唐妹,保密,2018-03-07 16:19:55,强烈推荐中央民族乐团的器乐剧《玄奘西行》，有王次恒大师参与，非常棒。,2,0
2661,大白熊教你压AK,男,2018-03-07 00:59:17,汉人喜欢明朝跟老虎爱吃肉猴子爱吃香蕉马儿爱吃草不是一个道理么？还需要争论什么啊？,3,0
2660,都市壁虎,保密,2018-03-06 17:08:00,东方有人，其名为华，华之多不知其几万万众也，聚而为国，其名为夏，夏之大不知其几万万里也。其状如山，雄浑壮丽，巍然而立，其势如龙，冲天而起，顶破苍穹，壮哉我华夏之土，美哉，我中央之国,19,0
2659,巨蛱号,保密,2018-03-05 23:21:40,此非彼国，国这个字就是小日本对中国的解构！前者城中有戈，后者只是有玉可以随便抢呵呵,0,1
2658,巨蛱号,保密,2018-03-05 23:16:19,中国什么时候去掉字母什么时候就是强国了,1,7
2657,啊哦额一wu语,保密,2018-03-05 22:36:46,膜拜膜拜,0,0
2656,M?bius,男,2018-03-05 20:11:02,"我一直觉得果粒老师的眼里有星星
(??)",8,0
2655,ROMON,保密,2018-03-05 18:55:31,感谢自己生在这个时代,3,0
2654,Q-Harper,女,2018-03-05 13:18:08,又复看了一遍 满心期待第二季啊???,5,0
2653,感谢中奖名单,保密,2018-03-04 21:42:33,千里江山图跟石鼓，我更倾向石鼓，文字是一个民族的根,10,3
2652,处江湖之远忧其君,女,2018-03-04 19:44:34,这么久了都不更新个花絮什么的吗[小电视_发愁],7,0
2651,会长大的云,保密,2018-03-04 19:33:35,当我把欧洲史和咱们国家的历史一起看的时候，你知道有多么震撼吗？生生世世不悔入种花家。,10,1
2650,前世谁与我回眸996,女,2018-03-04 19:30:42,春晚可能不属于央视。。,4,2
2649,世上好物要坚牢,男,2018-03-04 16:58:55,国家宝藏：劳资好忙啊！教歌手唱歌，教演员演戏，教综艺台玩综艺，教编剧怎么讲故事。涉猎有文化、历史、传承、国际、主持、舞美、文案、唱歌、跳舞、歌剧、舞剧、写歌、编曲、编舞、走秀……嗯，没啥意思，就是不想给别的节目活路，以后还会更皮更秀?,18,2
2648,Silhouette薄奠,保密,2018-03-04 16:43:28,本期全程高能，各路神仙打架,7,0
2647,温时i,女,2018-03-04 14:17:48,期待第二季,1,0
2646,优思铭想,女,2018-03-04 10:04:59,琴棋书画，希望下一季有棋,7,0
2645,海茵莉凯塞因维特根斯坦,女,2018-03-04 03:01:16,马克。,0,0
2644,LittleTreepple,男,2018-03-03 23:27:43,撒花(#^.^#),0,0
2643,5629,男,2018-03-03 21:23:18,央视大大，信中国会在b站播出吗？,4,0
2642,罗斯大人的大罗神通棍,女,2018-03-03 19:14:20,根据牛顿第三定律，加上网速的影响，B站的尿性，视频的热度，评论的数量，我的手速，还有高纬度生物和麒麟臂大佬出现的可能性，再加上此视频内容的争议性与不确定性对其他人的话题吸引力，还有手指与屏幕的摩擦的延迟速度集合公式运算，得出结论，我应该是2642楼,8,1
2641,忆永乐,保密,2018-03-03 15:43:28,开头的演奏 有曲名吗 太喜欢了 谁给个曲名,1,1
2640,一只可爱的姐控,女,2018-03-03 13:37:37,沉迷于国家宝藏,6,0
2639,涵小抒,女,2018-03-03 13:01:20,完结撒花啊,0,0
2638,队长陈皮,女,2018-03-03 12:47:47,大家相约第二季,1,0
2637,罗斯大人的大罗神通棍,女,2018-03-03 10:19:43,问一下想看我大河南应该在哪里空降,0,1
2636,Mori丶茉莉,保密,2018-03-02 23:51:13,我等一个大佬手里的那个印章出售。。。,1,0
2635,nixt,保密,2018-03-02 21:48:30,期待第二季 希望第二季老戏骨能多些，都是老戏骨也可以,2,0
2634,尘埃就是要落定,保密,2018-03-02 21:03:30,再来看一遍_(:_」∠)_,0,0
2633,且行行,女,2018-03-02 17:09:03,又刷一遍，收官这一期实在好看啊！,0,0
2631,吃睡乃人生大事,女,2018-03-02 15:14:12,那那故宫博物院展出这几件文物了没？我好去吸,0,1
2630,至曙曙曙,女,2018-03-02 13:42:57,给央视爸爸疯狂打call,0,0
2629,微月夕烟27,保密,2018-03-02 13:35:10,期待第二季！,1,0
2628,盆盆爱瑶瑶,男,2018-03-02 11:40:41,再有一个月我的小孩就降生了，请组织放心，我知道该怎么做！,13,0
2627,进水可桂,男,2018-03-02 10:50:18,完美的最后一期 看的人呢!,0,0
2626,三月u,保密,2018-03-02 10:41:04,所以第二季什么时候_(:з」∠)_,2,0
2625,凝荷倚鹃,保密,2018-03-02 10:22:47,你爸爸的春晚已经不是当年的春晚了，但是你爸爸的“国宝”永远是看不够的“国宝”,8,0
2624,三玖夫君,男,2018-03-02 02:26:41,我刷了5遍了，被水龙吟和闻一多的诗迷得不行……,4,0
2623,阿尔托留斯,男,2018-03-02 01:57:25,一眼千年,0,0
2622,南墙北雁,保密,2018-03-01 09:41:50,我又来了,0,0
2621,狐言喵语,男,2018-03-01 00:54:21,。。。这讲什么的？,0,1
2620,张尼玛的日常,女,2018-03-01 00:53:53,这期播放咋这么少！,0,1
2619,瑶光仙君,保密,2018-03-01 00:23:35,等我水上4级，我一定回来给《国家宝藏》评分评10分,10,2
2618,霍式乖巧,女,2018-02-28 21:31:55,我有一个不成熟的小建议，下一季能不能请霍尊吖(=?ω?=),6,0
2617,羡三岁的夷陵走尸,保密,2018-02-28 18:26:53,有没有宣读守护人宣言的cut？,0,0
2616,优思铭想,女,2018-02-28 16:38:42,琴棋书画，想问下一季有棋不？,4,0
2615,~羽羽,女,2018-02-28 14:42:55,九九归一十全十美，完美的第一季,3,0
2614,桑也,保密,2018-02-28 13:19:20,良心节目,2,0
2613,巴拉拉小魔基,男,2018-02-28 12:24:12,我周围人总是觉得我居然会喜欢去博物馆这种地方 其实不需要别人来认同我 只有我自己才知道我为什么喜欢去 那每一样文物在我眼里并不枯燥而是来自历史长河的感动和自豪，小时候特别喜欢国外觉得国外什么都好 后来大了以后才发现原来自己最爱的还是我大天朝 那种文化底蕴让我打从心底里感到骄傲和自豪，前段时间去南博偶然听到一个父亲指着那一样样的文物对着儿子说：“科技发展很快，所以一定要多活几年。”当时真的是一下扎心了，很庆幸自己能与博物馆相遇 发现这么多的美好 我爱我的国家！顺便期待第二季(｀?ω??),44,0
2612,千黛狐,女,2018-02-28 10:52:50,才想起来我没有投票 气哭,4,0
2611,点子王冯大蠢,保密,2018-02-28 00:46:12,我们国家独有的魅力,2,0
2610,凰紫音,保密,2018-02-27 23:56:03,春晚如果是这种画风的话我肯定会看,7,0
2609,Bili_38910518,保密,2018-02-27 20:39:28,(｀?ω??),0,0
2608,已散佚,男,2018-02-27 19:49:05,推荐一个APP……每日故宫[小电视_笑],2,0
2607,可靠の二萌萌,男,2018-02-27 18:57:55,揭晓嘉宾都是神仙啊，我的天呐,1,0
2606,野生阿伟,男,2018-02-27 16:20:42,读史可以明志，知古方能见今,6,0
2605,左边伊人,女,2018-02-27 11:22:51,一共才十期啊，我还没开始看呢,0,0
2604,金铃索夫人,保密,2018-02-26 22:53:17,那个走秀在哪啊！！！想回顾一下居然死活找不到了,1,2
